<?xml version="1.0" encoding="ISO-8859-1"?>
<!DOCTYPE suite SYSTEM "../tests/ajcTestSuite.dtd">
<suite>
<ajc-test dir="bugs160/pr173602" title="duplicate itd npe">
<compile files="X.java">
<message kind="error" line="2" text="intertype declaration from "/>
<message kind="error" line="2" text="Duplicate"/>
<message kind="error" line="3" text="intertype declaration from "/>
<message kind="error" line="3" text="Duplicate"/>
<message kind="error" line="6" text="intertype declaration from "/>
</compile>
</ajc-test>
</suite>
